{
  "request_id": "run-77c1:t1:f2",
  "kind": "finding",
  "statement": "Cần khóa van cấp nước của căn hộ trước khi tháo đầu nối.",
  "author": {
    "type": "agent",
    "id": "av-tech-0001",
    "name": "Agent Kỹ thuật"
  },
  "sources": [
    {
      "type": "entry",
      "id": "e-1"
    },
    {
      "type": "passage",
      "id": "doc:SOP-TECH-PLUMB-02@1#buoc-1"
    }
  ],
  "data_origin": "synthetic"
}
